{
  "branch": "main",
  "channel": "released",
  "commit": "4967bc13225dd21b600659de40fad3e03acae0aa",
  "customer_name": "PTM",
  "extra": {
    "lang": "HI",
    "unverifiable_keys": [
      "test_jig_app"
    ]
  },
  "params": {
    "customer_app": "V1.0.1",
    "customer_name": "PTM",
    "pcb_batch_id": "PCBA-PEN15SBL0926A",
    "sdk_version": "WM_SDK_C_260710",
    "sound_file_version": "V1.0.0_EN",
    "test_jig_app": "PTM_0_0_8",
    "test_jig_production_app": "WMZ_PTM_1.0.0"
  },
  "prefix": "PTM",
  "published_at": "2026-10-07T06:30:40Z",
  "publisher": {
    "eval_sha256": "19549580ca132e0fb1dc79b2b682282f534ca6a4488f327a5210cf52fe087e99",
    "eval_version": 1,
    "tool_version": "1.0.0"
  },
  "repo": "https://github.com/sp-wal-rd/PTM_TEST_ZIG_FAST.git",
  "schema": "https://raw.githubusercontent.com/sp-wal-rd/wm_zig_config/main/schema/zig.schema.json",
  "schema_version": 1,
  "sources": {
    "customer_app": "config.py",
    "customer_name": "declared",
    "pcb_batch_id": "config.py",
    "sdk_version": "config.py",
    "sound_file_version": "config.py",
    "test_jig_app": "config.py",
    "test_jig_production_app": "config.py"
  }
}
