{
  "branch": "main",
  "channel": "dev",
  "commit": "036fd036063fc368a06b0e83540e26ba3d260fb4",
  "customer_name": "PTM",
  "extra": {
    "lang": "HI",
    "unverifiable_keys": [
      "test_jig_app"
    ]
  },
  "params": {
    "customer_app": "V1.0.0",
    "customer_name": "PTM",
    "pcb_batch_id": "PCBA\u2013SBID-PCY15SBL0326A",
    "sdk_version": "WM_SDK_C_260210",
    "sound_file_version": "V1.0.0_HI",
    "test_jig_app": "PTM_0_0_7",
    "test_jig_production_app": "WM_PRD_TEST_ZIG_1605_200326_PTM"
  },
  "prefix": "PTM",
  "published_at": "2026-10-07T05:58:45Z",
  "publisher": {
    "eval_sha256": "68c774c32878499cb3363b479b19ca780b6484d351d7d2e522fda928ecac00f6",
    "eval_version": 1,
    "tool_version": "1.0.0"
  },
  "repo": "https://github.com/sp-wal-rd/PTM_TEST_ZIG_FAST.git",
  "schema": "https://raw.githubusercontent.com/sp-wal-rd/wm_zig_config/main/schema/zig.schema.json",
  "schema_version": 1,
  "sources": {
    "customer_app": "config.py",
    "customer_name": "declared",
    "pcb_batch_id": "config.py",
    "sdk_version": "config.py",
    "sound_file_version": "config.py",
    "test_jig_app": "declared",
    "test_jig_production_app": "config.py"
  }
}
