{
  "branch": "master",
  "channel": "released",
  "commit": "b6335b441a553a135ee6428fb0d50f05b8a7b7d4",
  "customer_name": "APB",
  "params": {
    "customer_app": "APBA_1605_2_RL_PROD_1_0_1",
    "customer_name": "APB",
    "pcb_batch_id": "LBID-PCY15ETR1726A",
    "sdk_version": "WM_SDK_C_260908",
    "sound_file_version": "APB_XXX_v1.0.7",
    "test_jig_app": "APB_1_0_1",
    "test_jig_production_app": "APBA_TEST_ZIG_1_0_0"
  },
  "prefix": "APB",
  "published_at": "2026-10-09T12:37:55Z",
  "publisher": {
    "eval_sha256": "19549580ca132e0fb1dc79b2b682282f534ca6a4488f327a5210cf52fe087e99",
    "eval_version": 1,
    "tool_version": "1.0.0"
  },
  "repo": "https://github.com/Jaydeep2990/APB_TEST_ZIG_FAST.git",
  "schema": "https://raw.githubusercontent.com/sp-wal-rd/wm_zig_config/main/schema/zig.schema.json",
  "schema_version": 1,
  "sources": {
    "customer_app": "config.py",
    "customer_name": "declared",
    "pcb_batch_id": "config.py",
    "sdk_version": "config.py",
    "sound_file_version": "config.py",
    "test_jig_app": "config.py",
    "test_jig_production_app": "config.py"
  }
}
