{
  "branch": "main",
  "channel": "released",
  "commit": "7ced63b2ed7c14ddcb64fa78037b03c9db58f785",
  "customer_name": "SBIA",
  "params": {
    "customer_app": "SBIA_1605_2_RL_PROD_1.0.3",
    "customer_name": "SBIA",
    "pcb_batch_id": "PCBA-HGRT-PCY15AHS1826A",
    "sdk_version": "WM_SDK_C_260824",
    "sound_file_version": "SBIA_XXX_v1.0.0",
    "test_jig_app": "SBIA_1_0_3",
    "test_jig_production_app": "SBIA_TEST_ZIG_1_0_1"
  },
  "prefix": "SBIA",
  "published_at": "2026-10-09T13:32:50Z",
  "publisher": {
    "eval_sha256": "19549580ca132e0fb1dc79b2b682282f534ca6a4488f327a5210cf52fe087e99",
    "eval_version": 1,
    "tool_version": "1.0.0"
  },
  "repo": "https://github.com/Jaydeep2990/SBIA_TEST_ZIG.git",
  "schema": "https://raw.githubusercontent.com/sp-wal-rd/wm_zig_config/main/schema/zig.schema.json",
  "schema_version": 1,
  "sources": {
    "customer_app": "config.py",
    "customer_name": "declared",
    "pcb_batch_id": "config.py",
    "sdk_version": "config.py",
    "sound_file_version": "config.py",
    "test_jig_app": "config.py",
    "test_jig_production_app": "config.py"
  }
}
