{
  "branch": "master",
  "channel": "released",
  "commit": "a55e1dfe57fb5ff46ce2674b64bcccc8cb1c826b",
  "customer_name": "BPCV2",
  "params": {
    "customer_app": "v30",
    "customer_name": "BPCV2",
    "pcb_batch_id": "PCBA-BBID-PCY15NBT0225A",
    "sdk_version": "SDK_B_241231",
    "sound_file_version": "1.0",
    "test_jig_app": "1.0.0",
    "test_jig_production_app": "BPC_PRD_101025_V4"
  },
  "prefix": "BPCV2",
  "published_at": "2026-10-09T13:43:42Z",
  "publisher": {
    "eval_sha256": "19549580ca132e0fb1dc79b2b682282f534ca6a4488f327a5210cf52fe087e99",
    "eval_version": 1,
    "tool_version": "1.0.0"
  },
  "repo": "https://github.com/Jaydeep2990/BPCV2_TEST_ZIG.git",
  "schema": "https://raw.githubusercontent.com/sp-wal-rd/wm_zig_config/main/schema/zig.schema.json",
  "schema_version": 1,
  "sources": {
    "customer_app": "config.py",
    "customer_name": "declared",
    "pcb_batch_id": "config.py",
    "sdk_version": "config.py",
    "sound_file_version": "config.py",
    "test_jig_app": "config.py",
    "test_jig_production_app": "config.py"
  }
}
